{
  "$schema": "http://json-schema.org/draft-07/schema#",
  "$id": "https://github.com/awase-skill/profile.schema.json",
  "title": "Awase Profile",
  "description": "Perfil personal de entrenamiento adaptativo del desarrollador",
  "type": "object",
  "required": ["version", "created_at", "concepts", "sessions"],
  "properties": {
    "consecutive_code_exercises": {
      "type": "integer",
      "minimum": 0,
      "default": 0,
      "description": "Número de ejercicios code-based consecutivos desde el último theory. Se resetea a 0 al hacer un theory."
    },
    "version": {
      "type": "string",
      "const": "1",
      "description": "Versión del schema"
    },
    "created_at": {
      "type": "string",
      "format": "date",
      "description": "Fecha de creación del perfil (ISO 8601)"
    },
    "last_session": {
      "type": ["string", "null"],
      "format": "date",
      "description": "Fecha de la última sesión /awase"
    },
    "concepts": {
      "type": "object",
      "description": "Mapa de concept_id → estado SM-2. El concept_id es un slug legible (e.g. 'promise-allsettled')",
      "additionalProperties": {
        "$ref": "#/$defs/concept"
      }
    },
    "sessions": {
      "type": "array",
      "description": "Historial de sesiones /awase",
      "items": {
        "$ref": "#/$defs/session"
      }
    }
  },
  "additionalProperties": false,
  "$defs": {
    "concept": {
      "type": "object",
      "required": ["name", "layer", "interval", "easiness_factor", "repetitions", "next_review", "history"],
      "properties": {
        "name": {
          "type": "string",
          "description": "Nombre legible del concepto (e.g. 'Promise.allSettled vs Promise.all')"
        },
        "layer": {
          "type": "integer",
          "enum": [1, 2],
          "description": "Capa del concepto: 1 = Surface (código visible), 2 = Underlying (fundamentos implícitos)"
        },
        "interval": {
          "type": "integer",
          "minimum": 1,
          "description": "Días hasta la próxima revisión (calculado por SM-2)"
        },
        "easiness_factor": {
          "type": "number",
          "minimum": 1.3,
          "description": "Factor de facilidad SM-2. Valor inicial: 2.5"
        },
        "repetitions": {
          "type": "integer",
          "minimum": 0,
          "description": "Número de repeticiones consecutivas con calidad >= 3. Se resetea a 0 si q < 3"
        },
        "next_review": {
          "type": "string",
          "format": "date",
          "description": "Fecha de la próxima revisión programada"
        },
        "last_quality": {
          "type": "integer",
          "minimum": 0,
          "maximum": 5,
          "description": "Calidad de la última respuesta en escala SM-2 (0-5)"
        },
        "last_exercise_type": {
          "type": "string",
          "enum": ["compare", "completar", "bug", "explicar", "theory"],
          "description": "Tipo del último ejercicio generado para este concepto"
        },
        "history": {
          "type": "array",
          "description": "Historial completo de revisiones de este concepto",
          "items": {
            "$ref": "#/$defs/revision"
          }
        }
      },
      "additionalProperties": false
    },
    "revision": {
      "type": "object",
      "required": ["date", "quality", "exercise_type"],
      "properties": {
        "date": {
          "type": "string",
          "format": "date",
          "description": "Fecha de la revisión"
        },
        "quality": {
          "type": "integer",
          "minimum": 0,
          "maximum": 5,
          "description": "Calidad de la respuesta en escala SM-2"
        },
        "exercise_type": {
          "type": "string",
          "enum": ["compare", "completar", "bug", "explicar", "theory"],
          "description": "Tipo de ejercicio utilizado"
        }
      },
      "additionalProperties": false
    },
    "session": {
      "type": "object",
      "required": ["date", "exercises", "correct"],
      "properties": {
        "date": {
          "type": "string",
          "format": "date",
          "description": "Fecha de la sesión"
        },
        "exercises": {
          "type": "integer",
          "minimum": 0,
          "description": "Número total de ejercicios en la sesión"
        },
        "correct": {
          "type": "integer",
          "minimum": 0,
          "description": "Número de respuestas correctas (quality >= 3)"
        },
        "concepts_trained": {
          "type": "array",
          "items": {
            "type": "string"
          },
          "description": "IDs de los conceptos entrenados en esta sesión"
        }
      },
      "additionalProperties": false
    }
  }
}
