{
  "version": "1",
  "created_at": "2026-05-01",
  "last_session": "2026-05-08",
  "concepts": {
    "redis-caching": {
      "name": "Redis caching patterns",
      "layer": 1,
      "interval": 7,
      "easiness_factor": 2.5,
      "repetitions": 2,
      "next_review": "2026-05-09",
      "last_exercise_type": "completar",
      "history": [
        {
          "date": "2026-05-01",
          "quality": 5,
          "exercise_type": "compare"
        },
        {
          "date": "2026-05-07",
          "quality": 4,
          "exercise_type": "completar"
        }
      ]
    },
    "promise-error-handling": {
      "name": "Promise error handling patterns",
      "layer": 1,
      "interval": 1,
      "easiness_factor": 2.5,
      "repetitions": 0,
      "next_review": "2026-05-09",
      "last_exercise_type": "bug",
      "history": [
        {
          "date": "2026-05-08",
          "quality": 2,
          "exercise_type": "bug"
        }
      ]
    },
    "cache-eviction": {
      "name": "Cache eviction strategies",
      "layer": 2,
      "interval": 15,
      "easiness_factor": 2.7,
      "repetitions": 3,
      "next_review": "2026-05-20",
      "last_exercise_type": "theory",
      "history": [
        {
          "date": "2026-04-20",
          "quality": 5,
          "exercise_type": "theory"
        },
        {
          "date": "2026-04-26",
          "quality": 5,
          "exercise_type": "compare"
        },
        {
          "date": "2026-05-05",
          "quality": 4,
          "exercise_type": "theory"
        }
      ]
    }
  },
  "sessions": [
    {
      "date": "2026-05-01",
      "exercises": 1,
      "correct": 1,
      "concepts_trained": ["redis-caching"]
    },
    {
      "date": "2026-05-07",
      "exercises": 1,
      "correct": 1,
      "concepts_trained": ["redis-caching"]
    },
    {
      "date": "2026-05-08",
      "exercises": 1,
      "correct": 0,
      "concepts_trained": ["promise-error-handling"]
    }
  ]
}
