{
  "version": "1",
  "created_at": "2026-04-01",
  "last_session": "2026-05-08",
  "concepts": {
    "async-await": {
      "name": "async/await syntax",
      "layer": 1,
      "interval": 39,
      "easiness_factor": 2.9,
      "repetitions": 5,
      "next_review": "2026-06-16",
      "last_exercise_type": "explicar",
      "history": [
        {
          "date": "2026-04-01",
          "quality": 5,
          "exercise_type": "completar"
        },
        {
          "date": "2026-04-02",
          "quality": 5,
          "exercise_type": "compare"
        },
        {
          "date": "2026-04-08",
          "quality": 5,
          "exercise_type": "bug"
        },
        {
          "date": "2026-04-23",
          "quality": 4,
          "exercise_type": "theory"
        },
        {
          "date": "2026-05-08",
          "quality": 5,
          "exercise_type": "explicar"
        }
      ]
    },
    "sql-transactions": {
      "name": "SQL transaction isolation",
      "layer": 1,
      "interval": 14,
      "easiness_factor": 2.6,
      "repetitions": 3,
      "next_review": "2026-05-09",
      "last_exercise_type": "compare",
      "history": [
        {
          "date": "2026-04-10",
          "quality": 4,
          "exercise_type": "completar"
        },
        {
          "date": "2026-04-11",
          "quality": 4,
          "exercise_type": "bug"
        },
        {
          "date": "2026-04-25",
          "quality": 3,
          "exercise_type": "compare"
        }
      ]
    },
    "cap-theorem": {
      "name": "CAP theorem trade-offs",
      "layer": 2,
      "interval": 1,
      "easiness_factor": 1.3,
      "repetitions": 0,
      "next_review": "2026-05-09",
      "last_exercise_type": "theory",
      "history": [
        {
          "date": "2026-05-05",
          "quality": 0,
          "exercise_type": "theory"
        },
        {
          "date": "2026-05-06",
          "quality": 1,
          "exercise_type": "theory"
        },
        {
          "date": "2026-05-08",
          "quality": 0,
          "exercise_type": "theory"
        }
      ]
    }
  },
  "sessions": [
    {
      "date": "2026-04-01",
      "exercises": 1,
      "correct": 1,
      "concepts_trained": ["async-await"]
    },
    {
      "date": "2026-04-02",
      "exercises": 1,
      "correct": 1,
      "concepts_trained": ["async-await"]
    },
    {
      "date": "2026-04-08",
      "exercises": 1,
      "correct": 1,
      "concepts_trained": ["async-await"]
    },
    {
      "date": "2026-04-10",
      "exercises": 1,
      "correct": 1,
      "concepts_trained": ["sql-transactions"]
    },
    {
      "date": "2026-04-11",
      "exercises": 1,
      "correct": 1,
      "concepts_trained": ["sql-transactions"]
    },
    {
      "date": "2026-04-23",
      "exercises": 1,
      "correct": 1,
      "concepts_trained": ["async-await"]
    },
    {
      "date": "2026-04-25",
      "exercises": 1,
      "correct": 1,
      "concepts_trained": ["sql-transactions"]
    },
    {
      "date": "2026-05-05",
      "exercises": 1,
      "correct": 0,
      "concepts_trained": ["cap-theorem"]
    },
    {
      "date": "2026-05-06",
      "exercises": 1,
      "correct": 0,
      "concepts_trained": ["cap-theorem"]
    },
    {
      "date": "2026-05-08",
      "exercises": 2,
      "correct": 1,
      "concepts_trained": ["async-await", "cap-theorem"]
    }
  ]
}
